ladder_id,direction,start_time,end_time,start_price,end_price,duration_bars,total_return,assumed_marches,assumed_platforms,local_case_ids_inside,local_cases_count,local_cases_covered_bars,coverage_share_by_local_cases,local_cases_start_count,local_cases_middle_count,local_cases_end_count,boundary_note
L1,UP,2023-07-06 12:00,2023-07-14 00:00,0.282300,0.361200,46,27.9490,1,1,"2,49",2,16,0.3478,1,0,1,initial July upward leg after early-July low
L2,DOWN,2023-07-14 00:00,2023-08-17 20:00,0.361200,0.254900,210,-29.4297,3,3,"12,16,19,29,32,38,41,45",8,62,0.2952,3,3,2,broad summer decline from July spike to August capitulation low
L3,UP,2023-08-17 20:00,2023-10-02 08:00,0.254900,0.266800,274,4.6685,3,4,"21,25,27,36,40,42,43,46,48",9,72,0.2628,2,4,3,choppy recovery from August low to early-October high
L4,DOWN,2023-10-02 08:00,2023-10-19 00:00,0.266800,0.240600,101,-9.8201,1,1,50,1,8,0.0792,0,1,0,October pullback into final pre-rally low
L5,UP,2023-10-19 00:00,2023-11-16 08:00,0.240600,0.393000,171,63.3416,4,4,"5,7,9,13,14,18,22,24,31,37,44",11,81,0.4737,3,5,3,main autumn upward ladder into November high
L6,DOWN,2023-11-16 08:00,2023-11-28 08:00,0.393000,0.377900,73,-3.8422,2,3,"10,15,26,28",4,32,0.4384,1,2,1,post-November-high pullback and compression
L7,UP,2023-11-28 08:00,2024-01-08 00:00,0.377900,0.474100,245,25.4565,4,4,"1,3,4,6,8,11,17,20,23,30,34,35,39",13,95,0.3878,3,9,1,December expansion with transition/retrace into January 2024
